programa_id,programa,anio_reportado,mes_reportado,estado_del_reporte,periodo_clave,observaciones_generales_del_mes,No.,Fecha *,Municipio *,Código corto del proyecto *,Nombre corto del proyecto,Tipo de asistencia / actividad *,Línea / enfoque *,¿Cuenta como nueva asistencia? *,Resultado o avance del mes,Evidencia / archivo / enlace,Observaciones,Nueva asistencia (auto),Estado fila,Sector: Alcantarillado,Sector: Tratamiento de aguas residuales,Sector: Desechos sólidos,Sector: Agua potable,Sector: Otro
,Fortalecimiento municipal,,Febrero,Final,2026-02,,1,2026-02-10,Sololá,1,Vertedero Picacho,Visita a planta de tratamiento,Gestión integral de residuos y desechos sólidos,Sí,Verificación del cierre de operaciones del vertedero municipal Picacho.,,,1,OK,,,Sí,,
,Fortalecimiento municipal,,Febrero,Final,2026-02,,2,2026-02-10,Sololá,2,PTRS Coxom,Visita a planta de tratamiento,Gestión integral de residuos y desechos sólidos,Sí,Diagnostico de operacion actual y planificación de nuevo relleno sanitario,,,1,OK,,,Sí,,
,Fortalecimiento municipal,,Febrero,Final,2026-02,,3,2026-02-11,San Antonio Palopó,3,PTRS San Antonio Palopó,Visita a planta de tratamiento,Gestión integral de residuos y desechos sólidos,Sí,Diagnostico para PIRDS,,,1,OK,,,Sí,,
,Fortalecimiento municipal,,Febrero,Final,2026-02,,4,2026-02-19,Santa Catarina Palopó,4,PTAR Santa Catarina Palopó,Visita a planta de tratamiento,Tratamiento de aguas residuales,Sí,Diagnostico de funcionamiento con consultor externo para estabilización de operacion.,,,1,OK,,Sí,,,
,Fortalecimiento municipal,,Febrero,Final,2026-02,,5,2026-02-23,San Antonio Palopó,3,PTRS San Antonio Palopó,Visita a planta de tratamiento,Gestión integral de residuos y desechos sólidos,No,Levantamiento de fotogrametría de relleno sanitario,,,0,OK,,,Sí,,
,Fortalecimiento municipal,,Febrero,Final,2026-02,,6,2026-02-24,Santa Catarina Palopó,4,Simulacro nacional de terremoto,Otro,Otro,Sí,Llenado de boleta de evaluacion de respuesta de terremoto,,,1,OK,,,,,Sí
,Fortalecimiento municipal,,Febrero,Final,2026-02,,7,2026-02-25,Panajachel,5,Visita a centro de acopio AR,Visita a planta de tratamiento,Gestión integral de residuos y desechos sólidos,Sí,Acompañamiento técnico a profesionales de USAC para conocer sobre el manejo de reciclables de AR,,,1,OK,,,Sí,,
,Fortalecimiento municipal,,Febrero,Final,2026-02,,8,2026-03-05,San Juan La Laguna,6,Visita a terreno para centro de transferencia AR,Seguimiento técnico,Gestión integral de residuos y desechos sólidos,Sí,Referencia para elaboración de EIA,,,1,OK,,,Sí,,
,Fortalecimiento municipal,,Febrero,Final,2026-02,,9,2026-03-08,San Juan La Laguna,6,Visita a PTRS,Seguimiento técnico,Gestión integral de residuos y desechos sólidos,No,"diagnostico para recuperación y manejo de PTRS, seguimiento PIRDS, Estudio de caracterizacion de residuos sólidos sector comercial y de mercados.",,No nos atendieron por situacion de auditoria municipal,0,OK,,,Sí,,
